{
  "config": {
    "width": 1920,
    "height": 1080,
    "samples_per_pixel": 100,
    "max_depth": 50
  },
  "camera": {
    "position": [0, 0, 8],
    "look_at": [0, 0, 0],
    "up": [0, 1, 0],
    "fov": 90,
    "aspect_ratio": "16/9",
    "defocus_angle": 0,
    "focus_dist": 10
  },

  "objects": {
    "sphere": [
      { "center": [0, 0, 0], "radius": 1.0, "material": 4 }
    ],

    "plane": [
    ],
    "quad": [
     {
          "corner": [-6, -6, -4],
          "u": [0, 12, 0],
          "v": [0, 0, -12],
          "material": 2
        },
        {
          "corner": [6, -6, -4],
          "u": [0, 0, -12],
          "v": [0, 12, 0],
          "material": 2
        },
        {
          "corner": [-6, 6, -4],
          "u": [12, 0, 0],
          "v": [0, 0, -12],
          "material": 4
        },
        {
          "corner": [-6, -6, -4],
          "u": [0, 0, -12],
          "v": [12, 0, 0],
          "material": 4
        },
        {
          "corner": [-6, -6, -16],
          "u": [0, 12, 0],
          "v": [12, 0, 0],
          "material": 5
        }
     ]
  },

  "materials": [
    { "type": "dielectric", "refraction_index": 1.5 },
    { "type": "metal", "albedo": [0.9, 0.9, 0.9], "fuzz": 0.05 },
    { "type": "lambertian", "albedo": [0.75, 0.75, 0.75] },
    { "type": "lambertian", "albedo": [0.5, 0.5, 0.5] },
    { "type": "lambertian", "albedo": [0.8, 0.2, 0.2] },
    { "type": "lambertian", "albedo": [0.2, 0.8, 0.2] },
    { "type": "lambertian", "albedo": [0.9, 0.9, 0.9] },
    { "type": "lambertian", "albedo": [0.7, 0.7, 0.7] }
  ]
}

