{
  "config": {
    "width": 720,
    "height": 720,
    "samples_per_pixel": 50,
    "max_depth": 50
  },
  "camera": {
    "position": [0, -100, 0],
    "look_at": [0, 0, 0],
    "up": [0, 0, 1],
    "fov": 90,
    "aspect_ratio": "1/1",
    "defocus_angle": 0,
    "focus_dist": 120.0
  },

  "objects": {
    "sphere": [
    ],

    "plane": [
    ],

    "triangle": [
    ],

    "quad": [
      {
        "corner": [-100, 200, -100],
        "u": [200, 0, 0],
        "v": [0, 0, 200],
        "material": 1
      },
      {
        "corner": [-100, -100, -50],
        "u": [200, 0, 0],
        "v": [0, 200, 0],
        "material": 5
      }
    ],

    "boxes": [
    ],

    "models": [
      {
        "file": "data/chess_scene_pieces/chess_scene_pieces.obj",
        "position": [0, 0, -30],
        "scale": 4
      }
    ]
  },

  "materials": [
    { "type": "dielectric", "refraction_index": 1.5 },
    { "type": "emissive", "emission": [1, 1, 1] },
    { "type": "lambertian", "albedo": [0.75, 0.75, 0.75] },
    { "type": "lambertian", "albedo": [0.5, 0.5, 0.5] },
    { "type": "lambertian", "albedo": [0.8, 0.2, 0.2] },
    { "type": "lambertian", "albedo": [0.2, 0.8, 0.2] },
    { "type": "metal", "albedo": [0.9, 0.9, 0.9], "fuzz": 0.05 },
    { "type": "lambertian", "albedo": [0.9, 0.9, 0.9] },
    { "type": "lambertian", "albedo": [0.7, 0.7, 0.7] }
  ]
}

