{
  "config": {
    "width": 1080,
    "height": 1080,
    "samples_per_pixel": 50,
    "max_depth": 50
  },
  "camera": {
    "position": [0, 0, 80],
    "look_at": [0, 0, 0],
    "up": [0, 1, 0],
    "fov": 90,
    "aspect_ratio": "1/1",
    "defocus_angle": 0,
    "focus_dist": 10.0
  },

  "objects": {
    "sphere": [
      { "center": [50, 0, -50], "radius": 20, "material": 1 }
    ],

    "plane": [
    ],

    "triangle": [
        {
            "p1": [20, 20, -195],
            "p2": [40, 0, -195],
            "p3": [0, 0, -195],
            "material": 6
        }
    ],

    "quad": [
    ],

    "boxes": [
        {
            "a": [-30, -120, -140],
            "b": [-90, 20, -200],
            "material": 2
        },
        {
            "a": [-40, -120, -120],
            "b": [0, -20, -80],
            "material": 2
        }
    ]
  },

  "materials": [
    { "type": "dielectric", "refraction_index": 1.5 },
    { "type": "emissive", "emission": [1, 1, 1] },
    { "type": "lambertian", "albedo": [0.75, 0.75, 0.75] },
    { "type": "lambertian", "albedo": [0.5, 0.5, 0.5] },
    { "type": "lambertian", "albedo": [0.8, 0.2, 0.2] },
    { "type": "lambertian", "albedo": [0.2, 0.8, 0.2] },
    { "type": "metal", "albedo": [0.9, 0.9, 0.9], "fuzz": 0.05 },
    { "type": "lambertian", "albedo": [0.9, 0.9, 0.9] },
    { "type": "lambertian", "albedo": [0.7, 0.7, 0.7] }
  ]
}

